{
  "schema_version": "0.1.0",
  "state_id": "gap_map:88888888",
  "created_at": "2026-04-27T00:07:00Z",
  "input_hash": "sha256:8888888888888888888888888888888888888888888888888888888888888888",
  "parent_state_ids": ["claim_graph:77777777"],
  "producer": {"name": "phase0-fixture", "version": "0.1.0", "run_id": "fixture"},
  "claim_graph_id": "claim_graph:77777777",
  "gaps": [
    {
      "gap_id": "gap-1",
      "description": "Benchmark coverage may be incomplete for low-compute methods.",
      "gap_type": "benchmark_blind_spot",
      "supporting_claim_ids": ["claim-1", "claim-2"],
      "evidence_status": "mixed",
      "roi_signals": {
        "positive": ["Clear story if blind spot is real"],
        "difficulty": ["Needs targeted benchmark audit"],
        "unknowns": ["Publication upside is unknown"],
        "reviewer_blockers": ["Reviewer may reject if closest work already covers this benchmark"]
      }
    }
  ]
}
